[
 {
  "id": "special-essence",
  "page": 498,
  "section_en": "Liqueurs and Rosolio",
  "title_it": "Essenza speciale",
  "title_en": "Special Essence",
  "method": "cold_mix",
  "yield": null,
  "alcohol_strength": {
   "degrees": 95,
   "raw": "alcool di 95°"
  },
  "temperature_c": null,
  "duration": null,
  "ingredients": [
   {
    "name_en": "Special essence (p. 250)",
    "name_it": "Essenza speciale (p. 250)",
    "qty": 25,
    "unit": "g",
    "unit_implicit": false
   },
   {
    "name_en": "Alcohol at 95°",
    "name_it": "Alcool di 95°",
    "qty": 12750,
    "unit": "ml",
    "unit_implicit": false
   },
   {
    "name_en": "Syrup",
    "name_it": "Siroppo",
    "qty": 4500,
    "unit": "ml",
    "unit_implicit": false
   },
   {
    "name_en": "Water",
    "name_it": "Acqua",
    "qty": 10,
    "unit": "ml",
    "unit_implicit": false
   }
  ],
  "steps_en": [],
  "notes_en": "Brown colour.",
  "confidence": 0.9
 },
 {
  "id": "seven-seeds-rosolio",
  "page": 498,
  "section_en": "Liqueurs and Rosolio",
  "title_it": "Sette semi (Rosolio)",
  "title_en": "Seven Seeds (Rosolio)",
  "method": "cold_mix",
  "yield": null,
  "alcohol_strength": {
   "degrees": 90,
   "raw": "alcool di 90°"
  },
  "temperature_c": null,
  "duration": null,
  "ingredients": [
   {
    "name_en": "Essential oil of angelica seed",
    "name_it": "Olio essenz. d'angelica (semi)",
    "qty": 30,
    "unit": "drops",
    "unit_implicit": true,
    "variants": [
     8
    ]
   },
   {
    "name_en": "Essential oil of fennel",
    "name_it": "Olio essenz. di finocchio",
    "qty": 30,
    "unit": "drops",
    "unit_implicit": true,
    "variants": [
     8
    ]
   },
   {
    "name_en": "Essential oil of coriander",
    "name_it": "Olio essenz. di coriandoli",
    "qty": 30,
    "unit": "drops",
    "unit_implicit": true,
    "variants": [
     0
    ]
   },
   {
    "name_en": "Essential oil of anise",
    "name_it": "Olio essenz. di anice",
    "qty": 30,
    "unit": "drops",
    "unit_implicit": true,
    "variants": [
     30
    ]
   },
   {
    "name_en": "Essential oil of celery",
    "name_it": "Olio essenz. di sedano",
    "qty": 30,
    "unit": "drops",
    "unit_implicit": true,
    "variants": [
     12
    ]
   },
   {
    "name_en": "Essential oil of lemon",
    "name_it": "Olio essenz. di limone",
    "qty": 30,
    "unit": "drops",
    "unit_implicit": true,
    "variants": [
     8
    ]
   },
   {
    "name_en": "Essential oil of orange",
    "name_it": "Olio essenz. di arancio",
    "qty": 15,
    "unit": "drops",
    "unit_implicit": true,
    "variants": [
     null
    ]
   },
   {
    "name_en": "Essential oil of caraway",
    "name_it": "Olio essenz. di carvi",
    "qty": null,
    "unit": "drops",
    "unit_implicit": true,
    "note": "omitted in variant I",
    "variants": [
     30
    ]
   },
   {
    "name_en": "Alcohol at 90°",
    "name_it": "Alcool di 90°",
    "qty": 2,
    "unit": "kg",
    "unit_implicit": false,
    "variants": [
     1.5
    ]
   },
   {
    "name_en": "Sugar",
    "name_it": "Zucchero",
    "qty": 2.4,
    "unit": "kg",
    "unit_implicit": false,
    "variants": [
     2
    ]
   },
   {
    "name_en": "Water",
    "name_it": "Acqua",
    "qty": 2,
    "unit": "l",
    "unit_implicit": false,
    "variants": [
     1.5
    ]
   }
  ],
  "steps_en": [
   "Filter the mixture."
  ],
  "notes_en": "Yellow caramel colour.",
  "confidence": 0.85
 },
 {
  "id": "sudano",
  "page": 498,
  "section_en": "Liqueurs and Rosolio",
  "title_it": "Sudano",
  "title_en": "Sudano",
  "method": "cold_mix",
  "yield": null,
  "alcohol_strength": {
   "degrees": 90,
   "raw": "alcool di 90°"
  },
  "temperature_c": null,
  "duration": null,
  "ingredients": [
   {
    "name_en": "Essential oil of celery",
    "name_it": "Olio essenz. di sedano",
    "qty": 30,
    "unit": "drops",
    "unit_implicit": true
   },
   {
    "name_en": "Alcohol at 90°",
    "name_it": "Alcool di 90°",
    "qty": 42,
    "unit": "ml",
    "unit_implicit": false
   },
   {
    "name_en": "Syrup",
    "name_it": "Siroppo",
    "qty": 15,
    "unit": "ml",
    "unit_implicit": false
   },
   {
    "name_en": "Water",
    "name_it": "Acqua",
    "qty": 6.25,
    "unit": "ml",
    "unit_implicit": false
   }
  ],
  "steps_en": [],
  "notes_en": "Colourless.",
  "confidence": 0.88
 },
 {
  "id": "usquebaugh-scottish",
  "page": 498,
  "section_en": "Liqueurs and Rosolio",
  "title_it": "Usquebaugh scozzese",
  "title_en": "Usquebaugh Scottish",
  "method": "cold_mix",
  "yield": {
   "amount": 10,
   "unit": "l",
   "note": "product yield at 40% alcohol"
  },
  "alcohol_strength": {
   "degrees": 90,
   "raw": "alcool di 90°"
  },
  "temperature_c": null,
  "duration": null,
  "ingredients": [
   {
    "name_en": "Essential oil of cloves",
    "name_it": "Olio essenz. di garofani",
    "qty": 12,
    "unit": "drops",
    "unit_implicit": true
   },
   {
    "name_en": "Essential oil of anise",
    "name_it": "Olio essenz. di anice",
    "qty": 12,
    "unit": "drops",
    "unit_implicit": true
   },
   {
    "name_en": "Essential oil of mace",
    "name_it": "Olio essenz. di macis",
    "qty": 1.2,
    "unit": "drops",
    "unit_implicit": true
   },
   {
    "name_en": "Essential oil of cardamom",
    "name_it": "Olio essenz. di cardamomo",
    "qty": 12,
    "unit": "drops",
    "unit_implicit": true
   },
   {
    "name_en": "Essential oil of lavender",
    "name_it": "Olio essenz. di lavanda",
    "qty": 24,
    "unit": "drops",
    "unit_implicit": true
   },
   {
    "name_en": "Essential oil of cinnamon flowers",
    "name_it": "Olio essenz. di fiori di cannella",
    "qty": 2,
    "unit": "g",
    "unit_implicit": false
   },
   {
    "name_en": "Alcohol at 90°",
    "name_it": "Alcool di 90°",
    "qty": 4.5,
    "unit": "kg",
    "unit_implicit": false
   },
   {
    "name_en": "Sugar",
    "name_it": "Zucchero",
    "qty": 1.8,
    "unit": "kg",
    "unit_implicit": false
   },
   {
    "name_en": "Water",
    "name_it": "Acqua",
    "qty": 4.5,
    "unit": "l",
    "unit_implicit": false
   }
  ],
  "steps_en": [],
  "notes_en": "Yellow colour. Product = 10 litres (alcohol 40%).",
  "confidence": 0.87
 }
]