[
 {
  "id": "clear-red-cochineal",
  "page": 712,
  "section_en": "Clear Red (Cochineal)",
  "title_it": "Rosso chiaro (cocciniglia)",
  "title_en": "Clear Red (Cochineal)",
  "method": "infusion",
  "yield": null,
  "alcohol_strength": {
   "degrees": 90,
   "raw": "alcool a 90°"
  },
  "temperature_c": null,
  "duration": null,
  "ingredients": [
   {
    "name_it": "Maggiorana",
    "name_en": "Marjoram",
    "qty": 100,
    "unit": "g",
    "unit_implicit": false
   },
   {
    "name_it": "Timo",
    "name_en": "Thyme",
    "qty": 50,
    "unit": "g",
    "unit_implicit": false
   },
   {
    "name_it": "Semi ambretta",
    "name_en": "Ambrette seeds",
    "qty": 30,
    "unit": "g",
    "unit_implicit": false
   },
   {
    "name_it": "Anice stellato",
    "name_en": "Star anise",
    "qty": 30,
    "unit": "g",
    "unit_implicit": false
   },
   {
    "name_it": "Cannella",
    "name_en": "Cinnamon",
    "qty": 30,
    "unit": "g",
    "unit_implicit": false
   },
   {
    "name_it": "Alcool a 90°",
    "name_en": "Alcohol at 90°",
    "qty": 6,
    "unit": "L",
    "unit_implicit": false
   },
   {
    "name_it": "Acqua",
    "name_en": "Water",
    "qty": 0,
    "unit": "L",
    "unit_implicit": false,
    "note": "quantity appears corrupt in OCR; context suggests clarification step"
   },
   {
    "name_it": "Zucchero",
    "name_en": "Sugar",
    "qty": 4,
    "unit": "kg",
    "unit_implicit": false
   }
  ],
  "steps_en": [
   "Macerate the botanicals in 6 L of alcohol at 90° to prepare an infusion.",
   "Filter the resulting tincture.",
   "Prepare the sugar solution separately (4 kg sugar dissolved in water).",
   "Add the clarified tincture to the sugar solution and reduce to 35° alcohol strength."
  ],
  "notes_en": "This recipe begins with a header mentioning Acqua Marocchina (Moroccan Water) and a reference to page 415, suggesting a base infusion is prepared first. The tincture must be well clarified before mixing with the syrup.",
  "ocr_flags": [
   "Acqua M a r o c c h in a – spacing corrupted",
   "Acqua quantity (lit. 0) – likely OCR error; should be clarified"
  ],
  "confidence": 0.75
 },
 {
  "id": "liqueur-di-sorrento",
  "page": 712,
  "section_en": "",
  "title_it": "Liquore di Sorrento",
  "title_en": "Liqueur of Sorrento",
  "method": "maceration",
  "yield": null,
  "alcohol_strength": {
   "degrees": 35,
   "raw": "riduce a 35°"
  },
  "temperature_c": null,
  "duration": {
   "amount": 24,
   "unit": "hours"
  },
  "ingredients": [
   {
    "name_it": "Scorze fresche di arance dolci",
    "name_en": "Fresh peel of sweet oranges",
    "qty": 10,
    "unit": "whole fruits",
    "unit_implicit": false
   },
   {
    "name_it": "Scorze fresche di arance amare",
    "name_en": "Fresh peel of bitter oranges",
    "qty": 10,
    "unit": "whole fruits",
    "unit_implicit": false
   },
   {
    "name_it": "Scorze fresche di limoni",
    "name_en": "Fresh peel of lemons",
    "qty": 10,
    "unit": "whole fruits",
    "unit_implicit": false
   },
   {
    "name_it": "Alcool a 85°",
    "name_en": "Alcohol at 85°",
    "qty": 5,
    "unit": "L",
    "unit_implicit": false,
    "note": "used for initial maceration"
   },
   {
    "name_it": "Alcool a 95°",
    "name_en": "Alcohol at 95°",
    "qty": 7,
    "unit": "L",
    "unit_implicit": false
   },
   {
    "name_it": "Acqua",
    "name_en": "Water",
    "qty": 7,
    "unit": "L",
    "unit_implicit": false
   },
   {
    "name_it": "Siroppo",
    "name_en": "Syrup",
    "qty": 14,
    "unit": "L",
    "unit_implicit": false
   },
   {
    "name_it": "Acqua di fiori d'arancio",
    "name_en": "Orange flower water",
    "qty": 0.5,
    "unit": "L",
    "unit_implicit": false
   }
  ],
  "steps_en": [
   "Macerate the fresh peels (sweet orange, bitter orange, and lemon) in 5 L of alcohol at 85° for 24 hours to create a tincture.",
   "Prepare a separate mixture: combine 7 L alcohol at 95°, 7 L water, 14 L syrup, and 0.5 L orange flower water.",
   "Add the clarified tincture from step 1 to the mixture prepared in step 2.",
   "Reduce the liqueur to 35° alcohol strength.",
   "Age for an extended period before use."
  ],
  "notes_en": "This is a classic citrus liqueur from the Sorrento region. The recipe requires careful clarification of the initial tincture before blending. The final step emphasizes long aging before release, which allows flavors to mature and integrate.",
  "ocr_flags": [
   "aranoe – OCR corruption of 'arance' (oranges)",
   "difiori – should be 'di fiori' (spacing error)",
   "stagionatura – correct spelling confirmed"
  ],
  "confidence": 0.85
 }
]