[
 {
  "id": "wine-based-extract-with-spices",
  "page": 690,
  "section_en": "Extracts for Mulled Wine",
  "title_it": "Estratti per Vino brulé",
  "title_en": "Extract for Mulled Wine",
  "method": "other",
  "yield": null,
  "alcohol_strength": {
   "degrees": 90,
   "raw": "alcool di 90°"
  },
  "temperature_c": null,
  "duration": null,
  "ingredients": [
   {
    "name_it": "Vino bianco",
    "name_en": "White wine",
    "qty": 15,
    "unit": "liters",
    "unit_implicit": false
   },
   {
    "name_it": "Succo di ciliege",
    "name_en": "Cherry juice",
    "qty": 4,
    "unit": "liters",
    "unit_implicit": false
   },
   {
    "name_it": "Alcool di 90°",
    "name_en": "Alcohol at 90°",
    "qty": 5,
    "unit": "liters",
    "unit_implicit": false
   },
   {
    "name_it": "Zucchero",
    "name_en": "Sugar",
    "qty": 19,
    "unit": "kg",
    "unit_implicit": false
   },
   {
    "name_it": "Olio essenziale di garofani",
    "name_en": "Essential oil of cloves",
    "qty": 15,
    "unit": "grams",
    "unit_implicit": false
   },
   {
    "name_it": "Olio essenziale di cannella",
    "name_en": "Essential oil of cinnamon",
    "qty": 2,
    "unit": "grams",
    "unit_implicit": false
   },
   {
    "name_it": "Olio essenziale di cardamomo",
    "name_en": "Essential oil of cardamom",
    "qty": 2,
    "unit": "drops",
    "unit_implicit": false
   },
   {
    "name_it": "Acido citrico in polvere",
    "name_en": "Citric acid powder",
    "qty": 15,
    "unit": "grams",
    "unit_implicit": false
   }
  ],
  "steps_en": [
   "Dissolve the essential oils in 5 liters of alcohol.",
   "Boil the white wine with the sugar to the consistency where one part of this syrup mixed with 3 parts hot water yields the flavored wine.",
   "Add the cherry juice for color and combine with the remaining ingredients according to proportions."
  ],
  "notes_en": "This extract may be prepared ahead and then mixed with hot water as needed. The essential oils may be substituted for the corresponding spices and herbs in the preparation. When cherry juice is used instead of wine, it provides sufficient color to the product.",
  "ocr_flags": [],
  "confidence": 0.92
 }
]