[
 {
  "id": "pineapple-fresh-fruit",
  "page": 551,
  "section_en": "Composite Extracts by Blending Aromatic Spirit and Essential Oils",
  "title_it": "Ananas (Frutto fresco)",
  "title_en": "Pineapple (Fresh Fruit)",
  "method": "maceration",
  "yield": null,
  "alcohol_strength": {
   "degrees": 85,
   "raw": "alcool di 85°"
  },
  "temperature_c": null,
  "duration": {
   "amount": 8,
   "unit": "days"
  },
  "ingredients": [
   {
    "name_it": "frutto fresco",
    "name_en": "fresh pineapple fruit",
    "qty": 1,
    "unit": "kg",
    "unit_implicit": false
   },
   {
    "name_it": "alcool di 85°",
    "name_en": "alcohol 85°",
    "qty": 2,
    "unit": "litres",
    "unit_implicit": false
   },
   {
    "name_it": "essenza artificiale di ananas",
    "name_en": "artificial pineapple essence",
    "qty": 10,
    "unit": "drops",
    "unit_implicit": true,
    "note": "per 1 kg of extract"
   },
   {
    "name_it": "estratto di vaniglia",
    "name_en": "vanilla extract",
    "qty": 5,
    "unit": "drops",
    "unit_implicit": true,
    "note": "per 1 kg of extract"
   }
  ],
  "steps_en": [
   "Cut the fresh fruit into small pieces and introduce into bottles.",
   "Add 85° alcohol (2 litres per kg of fruit) and seal well.",
   "After maceration for 8 days, pour off the liquid, squeeze the fruit, and filter everything together.",
   "For every kg of extract obtained, add 10 drops of artificial pineapple essence and 5 drops of vanilla extract."
  ],
  "notes_en": "The proportions of essence and extract are per kg of final extract.",
  "ocr_flags": [],
  "confidence": 0.95
 },
 {
  "id": "benedictine-i",
  "page": 551,
  "section_en": "Composite Extracts by Blending Aromatic Spirit and Essential Oils",
  "title_it": "Benedettino. I.",
  "title_en": "Benedictine – Variant I",
  "method": "maceration",
  "yield": null,
  "alcohol_strength": {
   "degrees": 90,
   "raw": "alcool di 90°"
  },
  "temperature_c": null,
  "duration": {
   "amount": 8,
   "unit": "days"
  },
  "ingredients": [
   {
    "name_it": "Scorze d'arance dolci",
    "name_en": "sweet orange peel",
    "qty": 120,
    "unit": "grams",
    "unit_implicit": true
   },
   {
    "name_it": "Galanga",
    "name_en": "galangal",
    "qty": 120,
    "unit": "grams",
    "unit_implicit": true
   },
   {
    "name_it": "Zenzero",
    "name_en": "ginger",
    "qty": 120,
    "unit": "grams",
    "unit_implicit": true
   },
   {
    "name_it": "Genziana (rad.)",
    "name_en": "gentian root",
    "qty": 30,
    "unit": "grams",
    "unit_implicit": true
   },
   {
    "name_it": "Aloe",
    "name_en": "aloe",
    "qty": 20,
    "unit": "grams",
    "unit_implicit": true
   },
   {
    "name_it": "Cardamomo",
    "name_en": "cardamom",
    "qty": 10,
    "unit": "grams",
    "unit_implicit": true
   },
   {
    "name_it": "Macis",
    "name_en": "mace",
    "qty": 10,
    "unit": "grams",
    "unit_implicit": true
   },
   {
    "name_it": "Alcool di 90°",
    "name_en": "alcohol 90°",
    "qty": 2000,
    "unit": "ml",
    "unit_implicit": true
   },
   {
    "name_it": "Acqua",
    "name_en": "water",
    "qty": 1000,
    "unit": "ml",
    "unit_implicit": true
   },
   {
    "name_it": "Estratto di liquirizia",
    "name_en": "liquorice extract",
    "qty": 300,
    "unit": "grams",
    "unit_implicit": true
   },
   {
    "name_it": "Caramello",
    "name_en": "caramel",
    "qty": 300,
    "unit": "grams",
    "unit_implicit": true
   },
   {
    "name_it": "Olio essenz. di limoni",
    "name_en": "lemon essential oil",
    "qty": 30,
    "unit": "grams",
    "unit_implicit": true
   },
   {
    "name_it": "Olio essenz. di arancio",
    "name_en": "orange essential oil",
    "qty": 30,
    "unit": "grams",
    "unit_implicit": true
   },
   {
    "name_it": "Olio essenz. di assenzio",
    "name_en": "wormwood essential oil",
    "qty": 30,
    "unit": "grams",
    "unit_implicit": true
   },
   {
    "name_it": "Olio essenz. di anice",
    "name_en": "anise essential oil",
    "qty": 0,
    "unit": "grams",
    "unit_implicit": true,
    "note": "quantity appears to be zero or cut off in source"
   }
  ],
  "steps_en": [
   "Combine the sweet orange peel, galangal, ginger, gentian root, aloe, cardamom, and mace.",
   "Add 90° alcohol and water, seal, and macerate for 8 days.",
   "Strain, pressing the solids, and collect the liquid.",
   "Dissolve liquorice extract and caramel into the strained liquid.",
   "Add lemon, orange, wormwood, and anise essential oils, stirring well to combine."
  ],
  "notes_en": "This is the first variant of Benedictine. The final quantity of anise essential oil appears incomplete in the source text.",
  "ocr_flags": [
   "Macis (possibly Mace or Nutmeg mace)",
   "anise oil quantity incomplete"
  ],
  "confidence": 0.92
 }
]